text,option1,option2,option3,option4,correct_option,explanation,subject_id,question_image,explanation_image
Which of the following best differentiates a compound odontoma from a complex odontoma?,"Compound odontoma resembles small tooth-like structures, while complex odontoma is a disorganized mass of enamel and dentin.","Compound odontoma is radiolucent, while complex odontoma is radiopaque.","Compound odontoma is malignant, while complex odontoma is benign.","Compound odontoma arises from epithelial tissue, while complex odontoma arises from mesenchymal tissue.",1,"<b>Compound odontomas</b> consist of multiple miniature tooth-like structures (denticles), each containing enamel, dentin, and pulp arranged in a normal pattern. 
        <b>Complex odontomas</b>, by contrast, form an amorphous mass of enamel and dentin without recognizable tooth morphology.<br><br>
        <b>Radiographic features:</b><br>- Compound: multiple small, radiopaque tooth-like structures (usually anterior maxilla).<br>
        - Complex: irregular, dense radiopacity with a thin radiolucent border (often posterior mandible).<br><br>
        <b>High-yield recap:</b><br>- Both are hamartomas (not true neoplasms).<br>
        - Compound = organized toothlets; Complex = disorganized mass.",3,,
Kaposi’s sarcoma is caused by infection with which of the following viruses?,Epstein–Barr virus (EBV),Human herpesvirus‑8 (HHV‑8),Human papillomavirus (HPV‑16),Cytomegalovirus (CMV),2,"<b>Kaposi’s sarcoma</b> is a vascular neoplasm associated with infection by <b>human herpesvirus‑8 (HHV‑8)</b>.
        It commonly occurs in <b>immunocompromised patients</b>, especially those with AIDS.<br><br>
        <b>Clinical features:</b><br>- Red, purple, or brown macules, plaques, or nodules on the palate, gingiva, or skin.<br>
        - Histology shows spindle-shaped endothelial cells and slit-like vascular spaces.<br><br>
        <b>High-yield recap:</b><br>- HHV‑8 is necessary for development.<br>
        - Oral lesions often appear on the hard palate or gingiva.<br>
        - Common in HIV‑positive or immunosuppressed individuals.",3,,
Pemphigus vulgaris involves loss of adhesion between epithelial cells due to autoantibodies against which component?,Desmosomes (desmoglein‑3),Hemidesmosomes (BP180),Keratin filaments,Tight junctions,1,"<b>Pemphigus vulgaris</b> is an autoimmune blistering disorder caused by antibodies targeting <b>desmosomal proteins (desmoglein‑3 and desmoglein‑1)</b>.
        This leads to <b>loss of cohesion between keratinocytes</b>—a process called <b>acantholysis</b>.<br><br>
        <b>Histopathology:</b><br>- Intraepithelial (suprabasal) cleft formation.<br>- “Tombstone” basal cells attached to the basement membrane.<br>- Positive Nikolsky sign (epidermal sloughing).<br><br>
        <b>Differentiation:</b><br>- <b>Bullous pemphigoid:</b> subepithelial separation involving hemidesmosomes.<br><br>
        <b>High-yield recap:</b><br>- Pemphigus = intraepithelial, desmosomes.<br>- Pemphigoid = subepithelial, hemidesmosomes.",3,,
What is the most common cause of Bell’s palsy?,Idiopathic nerve compression,"Viral reactivation, typically herpes simplex virus type 1 (HSV‑1)",Lyme disease,Autoimmune inflammation,2,"<b>Bell’s palsy</b> is an acute, unilateral lower motor neuron facial paralysis, most commonly caused by <b>reactivation of herpes simplex virus type 1 (HSV‑1)</b> within the geniculate ganglion.<br><br>
        <b>Clinical features:</b><br>- Sudden facial droop on one side.<br>- Inability to close eye or smile symmetrically.<br>- Altered taste and hyperacusis possible.<br><br>
        <b>Management:</b><br>- Prednisone ± antiviral (acyclovir).<br>- Eye protection with artificial tears and taping at night.<br><br>
        <b>High-yield recap:</b><br>- HSV‑1 reactivation causes nerve inflammation.<br>- Most recover fully within 3–6 months.",3,,
Which of the following oral lesions has the highest risk of malignant transformation?,Fibroma,Leukoplakia,Erythroplakia,Lichen planus,3,"<b>Erythroplakia</b> is a <b>red, velvety mucosal patch</b> that cannot be identified as another condition clinically or histologically. 
        It carries the <b>highest malignant potential</b> among oral precancerous lesions — most cases show <b>moderate to severe epithelial dysplasia or carcinoma in situ</b> upon biopsy.<br><br>
        <b>In contrast:</b> Leukoplakia has variable dysplasia risk, and fibromas are benign reactive growths without malignant potential.<br><br>
        <b>Most common sites for erythroplakia:</b><br>- Floor of the mouth<br>- Ventral and lateral tongue<br>- Soft palate and tonsillar pillars<br><br>
        These are <b>thinly keratinized and vascular areas</b> prone to malignant change.<br><br>
        <b>High-yield recap:</b><br>- Erythroplakia = highest malignant potential.<br>- Biopsy mandatory.<br>- Common sites overlap with oral SCC hotspots.",3,,
Which of the following is <b>NOT</b> a predisposing factor for angular cheilitis?,Vitamin B deficiency,Reduced vertical dimension,Iron deficiency anemia,Iron overload,4,"<b>Angular cheilitis</b> (perleche) presents as erythematous fissures and soreness at one or both oral commissures. It is most often an <b>opportunistic Candida albicans</b> infection superimposed on local and systemic predispositions that create a moist, macerated environment.<br><br><b>Predisposing factors:</b><br>- <b>Reduced vertical dimension of occlusion (VDO)</b> → commissure folding and saliva pooling (common in denture wearers/edentulous).<br>- <b>Nutritional deficiencies</b> — especially <b>B-complex (B2/B6/B12)</b> and <b>iron deficiency anemia</b> — impair epithelial integrity and host defense.<br>- <b>Systemic risks</b>: diabetes mellitus, immunosuppression, xerostomia.<br><br><b>Not a risk:</b> <b>Iron overload</b> does not predispose to angular cheilitis.<br><br><b>High-yield recap:</b> Think <b>VDO loss + saliva pooling + B/iron deficiency</b> → Candida overgrowth.",3,,
Which autoimmune disorder is most commonly associated with secondary Sjögren’s syndrome?,Systemic lupus erythematosus,Rheumatoid arthritis,Hashimoto thyroiditis,Multiple sclerosis,2,"<b>Sjögren’s syndrome</b> is an autoimmune exocrinopathy targeting salivary and lacrimal glands → <b>xerostomia</b> and <b>xerophthalmia (sicca complex)</b>.<br><br><b>Primary</b> form occurs alone; <b>secondary</b> form coexists with another autoimmune disease — most commonly <b>rheumatoid arthritis (RA)</b> (others: SLE, scleroderma).<br><br><b>Serology:</b> anti‑SSA (Ro), anti‑SSB (La); RF and ANA often positive. <b>Oral</b>: rampant cervical caries, parotid enlargement, secondary candidiasis.<br><b>Risk:</b> markedly increased likelihood of <b>B‑cell (MALT) lymphoma</b> — monitor persistent gland swelling.<br><br><b>High-yield recap:</b> Sicca + SSA/SSB; secondary Sjögren’s is classically linked to <b>RA</b>.",3,,
Which systemic condition is most commonly associated with oral thrush (pseudomembranous candidiasis)?,Uncontrolled HIV infection,Diabetes insipidus,Iron overload,Vitamin D deficiency,1,"<b>Oral thrush</b> (pseudomembranous candidiasis) is an opportunistic infection by <b>Candida albicans</b> presenting as <b>white, curd‑like plaques</b> that wipe off to reveal erythema/bleeding.<br><br><b>Most common systemic association:</b> <b>Uncontrolled HIV</b> due to CD4+ T‑cell depletion and impaired mucosal immunity (also seen with poorly controlled diabetes, prolonged steroids/antibiotics, xerostomia).<br><br><b>Management:</b> topical nystatin/clotrimazole; systemic fluconazole if extensive; investigate for underlying immunosuppression.<br><br><b>High‑yield recap:</b> Thrush = immunosuppression clue — especially <b>HIV</b>.",3,,
"A 45‑year‑old presents with bleeding, swollen gums, perifollicular petechiae, easy bruising, and poor wound healing. Which vitamin deficiency best explains these findings?",Vitamin C (ascorbic acid),Vitamin K,Vitamin B12,Vitamin A,1,"Presentation is classic for <b>vitamin C deficiency</b> (scurvy). Vitamin C is required for <b>hydroxylation of proline and lysine</b> in <b>collagen synthesis</b>; deficiency weakens capillaries and connective tissues → <b>gingival bleeding</b>, <b>petechiae</b>, <b>ecchymoses</b>, and <b>delayed wound healing</b>.<br><br><b>Oral signs:</b> spongy/bleeding gingiva, periodontal ligament weakness, tooth mobility, secondary infection risk.<br><b>At risk:</b> elderly, alcohol use disorder, malabsorption, restrictive diets.<br><br><b>Differentiate:</b> K deficiency → coagulation defect (normal collagen); B12 → megaloblastic anemia/glossitis; A → epithelial metaplasia/night blindness.<br><br><b>High‑yield recap:</b> Vit C → collagen hydroxylation → deficiency = hemorrhage + poor healing.",3,,
"Which disease is characterized by non‑caseating granulomas, transmural inflammation, and skip lesions?",Crohn’s disease,Ulcerative colitis,Irritable bowel syndrome,Celiac disease,1,"<b>Crohn’s disease</b> vs <b>Ulcerative colitis (UC)</b> — both are IBD but differ in pattern and depth.<br><br><b>Crohn’s:</b> can involve the <b>entire GI tract</b> (mouth→anus), especially terminal ileum/colon; <b>transmural</b> inflammation with <b>skip lesions</b>; complications: strictures, fistulas; histology: <b>non‑caseating granulomas</b>. Oral: cobblestoning, aphthous‑like ulcers, cheilitis granulomatosa.<br><br><b>UC:</b> limited to <b>colon/rectum</b>, always starting at the rectum and extending <b>continuously</b> proximally; inflammation confined to <b>mucosa/submucosa</b>; complications: toxic megacolon, higher CRC risk; oral: <b>pyostomatitis vegetans</b> (yellow pustules on erythema).<br><br><b>High‑yield recap:</b> Crohn’s = skip, transmural, granulomas, anywhere; UC = continuous, mucosal, colon‑only, bloody diarrhea.",3,,
"A 5‑year‑old has fever for 5 days, bilateral conjunctival injection, cracked lips with strawberry tongue, cervical lymphadenopathy, and desquamation of the hands/feet. What is the most likely diagnosis?",Kawasaki disease,Scarlet fever,Hand‑foot‑and‑mouth disease,Measles (rubeola),1,"<b>Kawasaki disease</b> is an acute vasculitis of medium‑sized arteries in children &lt;5 years; it is a leading cause of acquired heart disease.<br><br><b>CRASH and burn:</b><br>C — Conjunctivitis (non‑exudative); R — polymorphous Rash; A — Adenopathy (cervical); S — Strawberry tongue/mucositis; H — Hands/feet erythema/edema/desquamation; + <b>fever &gt;5 days</b>.<br><br><b>Complication:</b> <b>Coronary artery aneurysms</b>, myocarditis, arrhythmias.<br><b>Treatment:</b> early <b>IVIG + aspirin</b> reduces cardiac risk.<br><br><b>High‑yield recap:</b> Pediatric vasculitis with mucocutaneous signs; think <b>IVIG + ASA</b> to prevent coronary sequelae.",3,,
Which jaw lesion is typically located below the inferior alveolar nerve (IAN) canal and shows a well-defined lingual cortical depression?,Stafne defect,Traumatic (simple) bone cyst,Residual cyst,Odontogenic keratocyst,1,"<b>Stafne bone defect</b> (static bone cavity; lingual mandibular salivary gland depression) is a <b>developmental pseudocyst</b> representing a depression on the <b>lingual surface</b> of the posterior mandible, usually containing <b>submandibular gland</b> tissue.<br><br><b>Radiographic clues:</b> well-corticated round/ovoid radiolucency classically <b>below the IAN canal</b>, near the angle/body of the mandible; incidental and asymptomatic.<br><b>Variants:</b> rare “upper” cases can occur at/above the canal; CBCT/MRI can confirm salivary tissue content.<br><b>Management:</b> none—diagnosis/observation only.<br><br><b>High-yield recap:</b> Below IAN • Lingual cortical depression • Salivary gland impression • No treatment.",3,,
Which of the following findings is most characteristic of Paget’s disease of bone (osteitis deformans)?,Mosaic (jigsaw) pattern of lamellar bone with prominent cement lines,Non‑caseating granulomas limited to mucosa,Woven bone without any lamellation,Osteoblastic rimming with Howship lacunae only,1,"<b>Paget’s disease of bone</b> features disordered remodeling: initial <b>osteoclastic resorption</b> followed by exuberant, disorganized <b>osteoblastic</b> deposition, producing enlarged but weak bone.<br><br><b>Histology hallmark:</b> <b>mosaic/jigsaw pattern</b> of lamellar bone with thick <b>cement lines</b> from repeated remodeling cycles.<br><b>Radiographic:</b> thickened trabeculae, cortical enlargement, <b>“cotton‑wool” skull</b>; maxilla may enlarge (tight dentures), teeth may show <b>hypercementosis</b>.<br><b>Labs:</b> elevated <b>alkaline phosphatase</b> with normal Ca/P.<br><b>Complications:</b> nerve compression, <b>osteosarcoma</b> (rare).<br><br><b>High‑yield recap:</b> Mosaic bone • Cotton‑wool skull • ↑ALP • Maxillary enlargement/hypercementosis.",3,,
Squamous cell carcinoma (SCC) arising in which oral site carries the worst prognosis?,Floor of the mouth,Buccal mucosa,Hard palate,Dorsum of tongue,1,"<b>Floor of the mouth SCC</b> has the <b>worst prognosis</b> among common oral sites due to thin mucosa, rich lymphatics, and proximity to vital spaces that permit early invasion and nodal spread.<br><br><b>Comparisons:</b> lateral/ventral tongue = high risk with frequent nodal metastasis; buccal mucosa/gingiva = variable (betel quid regions higher); hard palate/dorsum of tongue = thicker keratinized mucosa, generally better outcomes.<br><br><b>High‑yield recap:</b> Worst site → <b>floor of mouth</b>; most common site overall → <b>lateral/ventral tongue</b>.",3,,
"A radiolucent mandibular lesion with scalloped borders, discovered incidentally in a teenage patient, reveals an empty cavity upon surgical exploration. What is the most likely diagnosis?",Simple (traumatic) bone cyst,Stafne bone defect,Residual cyst,Odontogenic keratocyst,1,"<b>Simple bone cyst (SBC)</b>, aka <b>traumatic bone cyst</b>, is a <b>non‑epithelial pseudocyst</b>—an empty or serosanguineous cavity within bone, most often in the <b>mandible</b> of adolescents/young adults.<br><br><b>Radiographic:</b> well‑defined radiolucency with <b>scalloped margins</b> extending between roots; teeth remain <b>vital</b> without resorption.<br><b>Intraoperative:</b> cavity is typically <b>empty</b> or with scant fluid.<br><b>Etiology (theory):</b> trauma‑induced intramedullary hemorrhage that fails to organize, leading to cavity formation.<br><b>Treatment:</b> surgical curettage to induce bleeding → spontaneous bone fill over months.<br><br><b>High‑yield recap:</b> Teen mandibular radiolucency • Scallops between roots • Empty cavity • Curettage → heal.",3,,
Which of the following histologic findings is not characteristic of oral lichen planus?,Thickening of the stratum corneum (hyperkeratosis),Saw-tooth appearance of the rete ridges,Wickham’s striae,Increased length of rete pegs,4,"<b>Oral lichen planus (OLP)</b> is a chronic, immune-mediated mucocutaneous disorder that affects the oral mucosa and results from a <b>T-cell–mediated response</b> against basal keratinocytes.<br><br><b>Histopathologic features:</b><br>- Hyperkeratosis (ortho- or parakeratinized).<br>- Saw-tooth rete ridges.<br>- Band-like lymphocytic infiltrate at the epithelial-connective tissue interface.<br>- Basal cell degeneration (Civatte bodies).<br>- Wickham’s striae = clinical manifestation of hyperkeratosis seen as white lace-like lines.<br><br><b>Incorrect option explained:</b> Increased length of rete pegs is not typical of OLP; instead, rete pegs are often shortened or irregular.<br><br><b>High-yield recap:</b><br>- Immune-mediated basal cell destruction.<br>- “Saw-tooth” rete ridges, hyperkeratosis, and Wickham’s striae.<br>- Premalignant potential (especially erosive type).",3,,
Which of the following features is not associated with McCune-Albright syndrome?,Polyostotic fibrous dysplasia,Café-au-lait skin pigmentation,"Endocrine abnormalities (e.g., precocious puberty)",Blue sclera,4,"<b>McCune-Albright syndrome (MAS)</b> is caused by an activating mutation in the <b>GNAS gene</b>, leading to increased cAMP signaling.<br><br><b>Classic triad:</b><br>1. Polyostotic fibrous dysplasia (craniofacial bones, ribs, long bones).<br>2. Café-au-lait macules (coast of Maine borders).<br>3. Endocrinopathies such as precocious puberty, hyperthyroidism, Cushing’s, or acromegaly.<br><br><b>Incorrect option explained:</b> Blue sclera is characteristic of <b>osteogenesis imperfecta</b>, not MAS. OI results from a defect in collagen type I, causing bone fragility, dentinogenesis imperfecta, and blue sclera.<br><br><b>High-yield recap:</b><br>- MAS = fibrous dysplasia + café-au-lait + endocrine dysfunction.<br>- GNAS mutation → mosaicism → variable phenotype.<br>- Differentiate from osteogenesis imperfecta (collagen I defect, blue sclera).",3,,
Which of the following organs is oral squamous cell carcinoma most likely to metastasize to?,Brain,Lungs,Liver,Adrenal glands,2,"<b>Oral squamous cell carcinoma (SCC)</b> spreads via lymphatic and hematogenous routes.<br><br><b>Spread pattern:</b><br>- Regional: to <b>cervical lymph nodes</b> (submandibular, jugulodigastric).<br>- Distant: most commonly to the <b>lungs</b>, followed by the liver and bones.<br><br><b>Mechanism:</b> Tumor emboli enter the venous system through the internal jugular and brachiocephalic veins, reaching the pulmonary capillary bed first.<br><br><b>Incorrect options:</b><br>- Brain: uncommon for SCC.<br>- Liver: possible but secondary to lung involvement.<br>- Adrenal glands: rare and late finding.<br><br><b>High-yield recap:</b><br>- Local spread: cervical lymph nodes.<br>- Most common distant site: lungs.<br>- Distant metastasis = poor prognosis.",3,,
A patient reports sweating and flushing over the cheek and ear region while eating. This condition is known as:,Horner’s syndrome,Frey’s syndrome,Ramsay Hunt syndrome,Eagle’s syndrome,2,"<b>Frey’s syndrome</b> (gustatory sweating) results from aberrant regeneration of the <b>auriculotemporal nerve</b> following parotid surgery or trauma.<br><br><b>Mechanism:</b><br>- Parasympathetic fibers from CN IX (via the auriculotemporal branch of CN V3) meant for the parotid gland regenerate into nearby <b>sweat glands</b> of the overlying skin.<br>- During salivation, misdirected fibers activate sweat glands, causing sweating and flushing over the parotid region.<br><br><b>Clinical features:</b><br>- Unilateral sweating, warmth, or redness of the cheek while eating.<br>- Triggered by spicy or sour foods.<br><br><b>Diagnosis:</b> Minor’s starch–iodine test.<br><br><b>Treatment:</b> Botulinum toxin injections temporarily block acetylcholine release to sweat glands.<br><br><b>High-yield recap:</b><br>- Post-parotidectomy complication.<br>- Parasympathetic misdirection → sweating with eating.<br>- Managed with botulinum toxin.",3,,
Which of the following is the primary mode of transmission for the Zika virus?,Airborne droplets,Sexual contact,Aedes mosquito bite,Contaminated food or water,3,"<b>Explanation:</b><br>Zika virus is a <b>Flavivirus</b> primarily transmitted through the bite of infected <b>Aedes mosquitoes</b> (Aedes aegypti and Aedes albopictus). Transmission can also occur through sexual contact, blood transfusion, and perinatal routes, but mosquito transmission remains the most common.<br><br><b>Clinical significance:</b> Zika infection during pregnancy can lead to <b>microcephaly</b> and other congenital malformations (Congenital Zika Syndrome).",3,,
Langerhans cell histiocytosis most closely resembles which hematologic malignancy in its clinical and radiographic presentation?,Acute lymphoblastic leukemia,Multiple myeloma,Hodgkin lymphoma,Burkitt lymphoma,2,"<b>Explanation:</b><br><b>Langerhans cell histiocytosis (LCH)</b> is a clonal proliferation of dendritic (Langerhans) cells that often involves bone, skin, and oral tissues. It may present with <b>‘punched-out’ radiolucencies</b> on radiographs, mimicking <b>multiple myeloma</b>.<br><br>Histologically, LCH lesions show <b>Birbeck granules</b> (tennis-racket–shaped cytoplasmic organelles) and express <b>CD1a</b> and <b>S100</b> markers.<br><br>Common oral findings include loosening of teeth and alveolar bone destruction, particularly in children.",3,,
Which metabolic abnormality is most characteristic of acute ethanol intoxication?,Metabolic acidosis with elevated anion gap due to lactic acid accumulation,Metabolic alkalosis due to vomiting,Respiratory alkalosis due to hyperventilation,Hyperchloremic metabolic acidosis,1,"<b>Acute Alcohol Toxicity — Metabolic Effects</b><br><br>During acute intoxication, ethanol is metabolized in the liver by alcohol dehydrogenase → acetaldehyde, producing <b>excess NADH</b>.<br>This high NADH/NAD⁺ ratio disrupts normal metabolism:<br><br>• <b>Lactic acidosis:</b> Pyruvate → lactate conversion favored<br>• <b>Hypoglycemia:</b> Gluconeogenesis inhibited (oxaloacetate → malate)<br>• <b>Fatty liver:</b> ↑ NADH promotes fatty acid synthesis<br>• <b>Ketoacidosis:</b> May occur in chronic alcoholics<br><br><b>Summary:</b> Acute ethanol intoxication → lactic acidosis + hypoglycemia + fatty liver due to excess NADH.",3,,