text,option1,option2,option3,option4,correct_option,explanation,subject_id,question_image,explanation_image
Patients with uncontrolled diabetes mellitus are particularly predisposed to developing mucormycosis due to which of the following mechanisms?,"Elevated serum glucose impairs neutrophil chemotaxis and phagocytosis, facilitating fungal invasion.",Excess insulin secretion promotes growth of fungal hyphae in vascular tissues.,Increased bicarbonate buffering neutralizes acidic conditions required for fungal proliferation.,Enhanced T-cell function in hyperglycemia provides a favorable niche for fungal growth.,1,"Mucormycosis is an aggressive, opportunistic fungal infection caused by organisms of the order Mucorales (commonly Rhizopus species). It is strongly associated with uncontrolled diabetes mellitus, particularly in the setting of diabetic ketoacidosis (DKA). Hyperglycemia and acidosis impair neutrophil chemotaxis and oxidative burst, leading to ineffective clearance of fungal spores. Elevated free iron in acidosis further enhances fungal proliferation. The fungi characteristically invade vascular structures, causing tissue necrosis and black eschar formation in the nasal cavity, sinuses, or palate. Rhinocerebral mucormycosis is the most common presentation in diabetic patients, beginning with sinusitis-like symptoms and potentially progressing to orbital and brain involvement. Early recognition and management are critical, requiring antifungal therapy (amphotericin B), surgical debridement, and strict glycemic control. High-yield points: Risk factor: uncontrolled diabetes, especially DKA. Pathogenesis: impaired neutrophil function + increased free iron. Clinical: rapidly progressive rhinocerebral infection with tissue necrosis. Treatment: amphotericin B + surgical debridement + correction of hyperglycemia.",3,,
Which of the following is a general characteristic of bacteria?,"Eukaryotic, with membrane-bound organelles","Prokaryotic, lacking a nuclear membrane and true organelles",Capable of sexual reproduction via meiosis,"Multicellular, with compartmentalized functions",2,"Bacteria are <b>unicellular prokaryotic organisms</b>. Their DNA is in a nucleoid region without a nuclear membrane, and they lack membrane-bound organelles. They contain <b>70S ribosomes</b>, the target of many antibiotics. Reproduction occurs by <b>binary fission</b> (asexual). Most bacteria have a <b>peptidoglycan cell wall</b> for structural support. Genetic exchange occurs via horizontal transfer (transformation, conjugation, transduction).<br><br><b>High-yield points:</b><br><ul><li><b>Prokaryotic</b>, no nucleus or organelles</li><li><b>70S ribosomes</b></li><li><b>Binary fission</b> only</li><li><b>Peptidoglycan wall</b></li></ul><b>Why the other options are incorrect:</b><br><ul><li><b>Eukaryotic cells:</b> fungi, protozoa, humans have nuclei and organelles</li><li><b>Meiosis:</b> sexual reproduction in eukaryotes, not bacteria</li><li><b>Multicellular:</b> describes animals/plants, not bacteria</li></ul>",3,,
Which of the following best describes Buerger’s Disease (Thromboangiitis Obliterans)?,Autoimmune thyroiditis associated with iodine deficiency,"Recurring inflammation and thrombosis of small and medium arteries/veins of the extremities, strongly associated with tobacco use",Demyelinating disease of the central nervous system associated with autoimmunity,Vasospastic disorder of coronary arteries related to exertional stress,2,"<b>Buerger’s Disease</b> (Thromboangiitis Obliterans) is a <b>non-atherosclerotic, segmental vasculitis</b> affecting small and medium arteries and veins in the extremities. It is <b>strongly associated with tobacco use</b>. Pathology includes vessel wall inflammation, thrombosis, and eventual ischemia. Clinically: claudication, ischemic rest pain, ulcers, gangrene. May also present with Raynaud’s phenomenon and superficial thrombophlebitis. Most common in young male smokers. Treatment requires absolute smoking cessation.<br><br><b>High-yield points:</b><br><ul><li><b>Buerger’s = thromboangiitis obliterans</b></li><li><b>Small/medium extremity vessels</b></li><li><b>Strong tobacco link</b></li><li><b>Clinical:</b> ischemia, ulcers, gangrene</li></ul><b>Why the other options are incorrect:</b><br><ul><li><b>Autoimmune thyroiditis:</b> Hashimoto’s disease, not vasculitis</li><li><b>Demyelinating CNS disease:</b> multiple sclerosis</li><li><b>Vasospastic coronary disorder:</b> Prinzmetal’s angina</li></ul>",3,,
What is the most common cause of chronic renal failure worldwide?,Hypertension,Chronic glomerulonephritis,Diabetes mellitus,Polycystic kidney disease,3,"The most common cause of chronic kidney disease (CKD) and ESRD is <b>diabetes mellitus</b>, due to diabetic nephropathy. Hyperglycemia damages glomerular capillaries, leading to <b>glomerulosclerosis, proteinuria, and progressive renal failure</b>.<br><br>The second most common cause is <b>hypertension</b>, which causes hyaline arteriolosclerosis and ischemic nephropathy. Chronic glomerulonephritis and polycystic kidney disease are recognized but less common causes.<br><br><b>High-yield points:</b><br><ul><li>#1 cause of ESRD = Diabetes mellitus</li><li>#2 cause = Hypertension</li><li>Pathology: glomerulosclerosis, proteinuria, renal mass loss</li><li>ESRD requires dialysis or transplantation</li></ul><b>Why the other options are incorrect:</b><br><ul><li><b>Hypertension:</b> 2nd most common cause</li><li><b>Chronic glomerulonephritis:</b> less common today</li><li><b>Polycystic kidney disease:</b> genetic cause, rare</li></ul>",3,,
Which layer of the lung does not perceive pain when injured?,Parietal pleura,Visceral pleura,Costal pleura,Diaphragmatic pleura,2,"The <b>visceral pleura</b> lacks pain fibers and is innervated by autonomic nerves. Therefore, it does not transmit pain when inflamed or injured.<br><br>The <b>parietal pleura</b> is richly innervated by intercostal and phrenic nerves, making it very sensitive to pain. This explains the sharp, localized chest pain seen in pleuritis.<br><br><b>High-yield points:</b><br><ul><li>Visceral pleura = no pain sensation</li><li>Parietal pleura = pain-sensitive</li><li>Pleuritic chest pain arises from parietal pleura</li></ul><b>Why the other options are incorrect:</b><br><ul><li><b>Parietal pleura:</b> innervated, pain sensitive</li><li><b>Costal pleura:</b> branch of parietal pleura, innervated by intercostals</li><li><b>Diaphragmatic pleura:</b> innervated by phrenic, referred shoulder pain</li></ul>",3,,
"A point mutation in a single gene resulting in substitution of one amino acid for another, as seen in sickle cell disease, is an example of which type of mutation?",Nonsense mutation,Frameshift mutation,Missense mutation,Silent mutation,3,"Sickle cell disease is caused by a <b>missense mutation</b> in the β-globin gene (HBB). This substitutes glutamic acid with valine at position 6, altering hemoglobin's structure. HbS polymerizes under hypoxia, distorting RBCs into sickle shapes and causing vaso-occlusion and hemolysis.<br><br><b>High-yield points:</b><br><ul><li>Missense mutation = amino acid substitution</li><li>Sickle cell: Glu → Val at position 6</li><li>Results: HbS polymerization, vaso-occlusion</li></ul><b>Why the other options are incorrect:</b><br><ul><li><b>Nonsense:</b> introduces premature stop codon</li><li><b>Frameshift:</b> insertion/deletion alters reading frame</li><li><b>Silent:</b> codon change but same amino acid</li></ul>",3,,
Turner syndrome is associated with which karyotype?,"47, XXY","45, XO","47, XXX","46, XY",2,"<b>Turner syndrome</b> results from monosomy X (45, XO). Patients are phenotypically female with short stature, streak ovaries (infertility, amenorrhea), webbed neck, shield chest, and increased risk of congenital heart defects (coarctation of the aorta, bicuspid valve).<br><br><b>High-yield points:</b><br><ul><li>Karyotype: 45, XO</li><li>Features: streak ovaries, webbed neck, short stature</li><li>Cardiac: coarctation, bicuspid valve</li></ul><b>Why the other options are incorrect:</b><br><ul><li><b>47, XXY:</b> Klinefelter syndrome</li><li><b>47, XXX:</b> Triple X, often asymptomatic</li><li><b>46, XY:</b> normal male karyotype</li></ul>",3,,
"Which antibiotic prevents RNA polymerase from binding to DNA, thereby blocking transcription initiation?",Rifampin,Tetracycline,Erythromycin,Chloramphenicol,1,"<b>Rifampin</b> binds the β-subunit of bacterial RNA polymerase, preventing initiation of transcription. It is crucial in TB therapy (part of RIPE regimen) and prophylaxis for meningococcus and Hib. Adverse effects include hepatotoxicity and orange-red secretions; it is also a potent CYP450 inducer. Resistance occurs via <b>rpoB</b> gene mutation, so multi-drug therapy is essential.<br><br><b>High-yield points:</b><ul><li>Blocks RNA polymerase initiation</li><li>Used in TB, Hib, meningococcal prophylaxis</li><li>Adverse effects: hepatotoxicity, orange fluids, CYP induction</li><li>Resistance via rpoB mutation</li></ul><b>Why the other options are incorrect:</b><ul><li><b>Tetracycline:</b> 30S, blocks aminoacyl-tRNA</li><li><b>Erythromycin:</b> 50S, blocks translocation</li><li><b>Chloramphenicol:</b> 50S, inhibits peptidyl transferase</li></ul>",3,,
Which of the following is NOT a common systemic manifestation of chronic alcoholism?,Cirrhosis of the liver,Wernicke–Korsakoff syndrome,Peripheral neuropathy,Hypoglycemia due to excessive insulin secretion,4,"<b>Chronic Alcoholism — Systemic Effects</b><br><br>Chronic alcoholism causes widespread systemic damage through the toxic effects of ethanol and acetaldehyde, as well as nutritional deficiencies (particularly thiamine deficiency).<br><br><b>Key effects include:</b><br>• <b>Hepatic:</b> Fatty liver → alcoholic hepatitis → cirrhosis<br>• <b>Neurologic:</b> Wernicke–Korsakoff syndrome (thiamine deficiency: confusion, ataxia, ophthalmoplegia, memory loss)<br>• <b>Peripheral nerves:</b> Peripheral neuropathy<br>• <b>Cardiac:</b> Alcoholic cardiomyopathy, hypertension<br>• <b>Pancreas:</b> Chronic pancreatitis → diabetes<br>• <b>Hematologic:</b> Megaloblastic anemia (folate deficiency)<br>• <b>Oral findings:</b> Glossitis, angular cheilitis, ↑ oral carcinoma risk<br><br><b>Not true:</b> Hypoglycemia from excessive insulin secretion — alcohol impairs gluconeogenesis but does not cause hyperinsulinemia.",3,,
Which karyotype is associated with Klinefelter syndrome?,"45, XO","47, XXY","47, XXX","46, XY",2,"<b>Klinefelter syndrome</b> (47, XXY) results from meiotic nondisjunction or mosaicism. Patients are phenotypic males with tall stature, small firm testes, infertility, and gynecomastia. Hormonal profile: ↓ testosterone, ↑ FSH/LH, ↑ estrogen. Learning difficulties may occur. There is an increased risk of breast cancer and autoimmune disease. Management includes testosterone replacement and fertility counseling.<br><br><b>High-yield points:</b><ul><li>Karyotype = 47, XXY</li><li>Clinical: small testes, infertility, gynecomastia, tall stature</li><li>Hormones: ↓ testosterone, ↑ LH/FSH</li><li>Risks: breast cancer, autoimmunity</li></ul><b>Why the other options are incorrect:</b><ul><li><b>45, XO:</b> Turner syndrome</li><li><b>47, XXX:</b> triple X, often asymptomatic</li><li><b>46, XY:</b> normal male</li></ul>",3,,
Which of the following diseases is primarily transmitted by fleas?,Epidemic typhus,Bubonic plague,Malaria,Leishmaniasis,2,"The <b>bubonic plague</b>, caused by <i>Yersinia pestis</i>, is transmitted by <b>rat fleas (Xenopsylla cheopis)</b>. After biting an infected rodent, the flea transmits bacteria into humans, causing painful <b>buboes</b> (lymphadenitis). Untreated, it may progress to septicemic or pneumonic plague. Other vector-disease associations: <b>epidemic typhus</b> (body lice), <b>malaria</b> (Anopheles mosquito), <b>leishmaniasis</b> (sandfly).<br><br><b>High-yield points:</b><ul><li>Plague (*Y. pestis*) = fleas</li><li>Reservoirs: rodents</li><li>Clinical: buboes, high mortality untreated</li></ul><b>Why other options are incorrect:</b><ul><li>Typhus: spread by lice</li><li>Malaria: spread by mosquitoes</li><li>Leishmaniasis: spread by sandflies</li></ul>",3,,
A benign tumor of smooth muscle is called:,Leiomyoma,Rhabdomyoma,Lipoma,Fibroma,1,"A <b>leiomyoma</b> is a benign tumor of smooth muscle, most commonly found in the uterus (fibroids). These are estrogen-sensitive and may cause abnormal uterine bleeding, pelvic pain, and infertility. Histologically, they appear as bundles of spindle-shaped smooth muscle cells.<br><b>Rhabdomyoma:</b> benign skeletal muscle tumor.<br><b>Lipoma:</b> benign adipose tumor.<br><b>Fibroma:</b> benign fibrous tissue tumor.<br><br><b>High-yield points:</b><ul><li>Leiomyoma = smooth muscle</li><li>Most common site = uterus</li><li>Estrogen sensitive</li></ul>",3,,
Which neurotransmitter primarily modulates smooth muscle action potentials in the GI tract?,Acetylcholine,Dopamine,Norepinephrine,Serotonin,1,"GI smooth muscle activity is paced by interstitial cells of Cajal but modulated by neurotransmitters.<br><b>Acetylcholine:</b> depolarizes, increases excitability, enhances contraction.<br><b>Norepinephrine:</b> hyperpolarizes, decreases excitability, reduces contraction.<br>Other transmitters (serotonin, dopamine) play roles, but acetylcholine is the principal excitatory neurotransmitter.<br><br><b>High-yield points:</b><ul><li>ACh = excitatory, ↑ motility</li><li>NE = inhibitory, ↓ motility</li><li>ENS integrates autonomic input</li></ul>",3,,
Which virulence factors are characteristic of Neisseria gonorrhoeae and Haemophilus influenzae?,"N. gonorrhoeae = IgA protease, β-lactamase; H. influenzae = capsule",N. gonorrhoeae = capsule; H. influenzae = β-lactamase,N. gonorrhoeae = spore formation; H. influenzae = pili,Both organisms = toxin-mediated only,1,"<b>Neisseria gonorrhoeae:</b> lacks a capsule. Virulence factors include pili (adherence), IgA protease (mucosal invasion), antigenic variation, and β-lactamase (penicillin resistance).<br><b>Haemophilus influenzae type b:</b> virulence from polyribosylribitol phosphate capsule, allowing evasion of phagocytosis. Non-typeable strains lack capsule and cause otitis and bronchitis. Vaccination targets the capsule.<br><br><b>High-yield points:</b><ul><li>Gonococcus: IgA protease, pili, antigenic variation, β-lactamase</li><li>Hib: capsule = meningitis, epiglottitis</li><li>Vaccine targets capsule</li></ul>",3,,
Which organism is the most common cause of oral thrush and esophagitis in immunocompromised patients?,Aspergillus fumigatus,Candida albicans,Cryptococcus neoformans,Histoplasma capsulatum,2,"<b>Candida albicans</b> is the most common cause of oral thrush and esophagitis, particularly in immunocompromised patients (e.g., HIV/AIDS, chemotherapy, organ transplant). It is a normal commensal organism in the GI tract, mouth, and vagina, but overgrowth occurs when host defenses are weakened.<br><br>Candida can appear as yeast with pseudohyphae at 20°C and as true hyphae (germ tubes) at 37°C.<br><br><b>High-yield recap:</b> Candida → thrush, vaginitis, esophagitis; germ tubes at 37°C.",3,,
"A patient with uncontrolled diabetes in ketoacidosis develops necrotic lesions in the nasal cavity and orbit. Microscopy shows broad, non-septate hyphae branching at right angles. Which fungus is responsible?",Candida albicans,Aspergillus fumigatus,Mucor/Rhizopus,Histoplasma capsulatum,3,"<b>Mucor and Rhizopus species</b> cause mucormycosis, particularly in patients with diabetic ketoacidosis.<br><br>These fungi are characterized by <b>broad, ribbon-like, non-septate hyphae</b> that branch at 90°. They invade blood vessels, leading to ischemia, necrosis, and black eschars in the nasal cavity and orbit, with possible extension into the brain.<br><br>Prompt surgical debridement and antifungal therapy (amphotericin B) are required.<br><br><b>High-yield recap:</b> Mucor/Rhizopus → diabetic ketoacidosis, broad non-septate hyphae, 90° branching, vascular invasion, black eschars.",3,,
What is the most efficient screening test for histoplasmosis in endemic regions?,India ink stain of CSF,Sputum culture for fungi,Histoplasma urine antigen test,Chest radiograph,3,"<b>Histoplasma capsulatum</b> is a dimorphic fungus endemic to the Ohio and Mississippi River valleys, commonly found in soil enriched with bird and bat droppings.<br><br>Although culture and histopathology can confirm the diagnosis, the <b>Histoplasma urine antigen test</b> is the most sensitive and efficient screening method, particularly in immunocompromised patients. Chest radiographs may mimic tuberculosis but are not specific. India ink stain is used for Cryptococcus, not Histoplasma.<br><br><b>High-yield recap:</b> Histoplasmosis → Ohio/Mississippi River valleys, bird/bat droppings, macrophage infection; urine antigen test = best screening tool, associated with SVC syndrome and granulomatous inflamation",3,,
"Which is the most common skin cancer, often presenting as a 'rodent ulcer' on sun-exposed areas?",Basal cell carcinoma,Squamous cell carcinoma,Melanoma,Kaposi sarcoma,1,"<b>Basal cell carcinoma (BCC)</b> is the most common skin cancer. It presents as a <b>pearly papule with telangiectasias</b>, and in ulcerated lesions, the classic term <b>'rodent ulcer'</b> is used. BCC is locally invasive but <b>rarely metastasizes</b>. Prolonged UV exposure is the major risk factor.<br><br><b>High-yield recap:</b><br>- BCC = most common skin cancer<br>- Pearly papule ± ulcer ('rodent ulcer')<br>- Locally invasive, rare metastasis",3,,
A patient presents with a painless genital ulcer (chancre) that heals spontaneously. Which stage of syphilis is this most characteristic of?,Primary syphilis,Secondary syphilis,Latent syphilis,Tertiary syphilis,1,"<b>Primary syphilis</b> is caused by <i>Treponema pallidum</i> and presents as a <b>painless chancre</b> at the site of inoculation (genital, anal, or oral).<br><br>The ulcer is indurated with a clean base and heals spontaneously in 3–6 weeks. At this stage, spirochetes are replicating locally and spreading via lymphatics.<br><br>- <b>Secondary syphilis:</b> systemic spread → diffuse rash (palms/soles), condyloma lata, lymphadenopathy.<br>- <b>Latent syphilis:</b> asymptomatic, positive serology only.<br>- <b>Tertiary syphilis:</b> gummas, neurosyphilis, cardiovascular complications.<br><br><b>High-yield recap:</b> Primary syphilis = painless chancre; heals spontaneously; precedes systemic secondary stage.",3,,
Multiple myeloma is associated with which abnormal protein findings?,Alpha-fetoprotein,Bence Jones proteins and Russell bodies,PSA and acid phosphatase,Cryoglobulins,2,"<b>Multiple myeloma</b> is a plasma cell neoplasm producing <b>monoclonal immunoglobulins</b>. It features <b>Bence Jones proteins</b> (urinary light chains) and <b>Russell bodies</b> (immunoglobulin inclusions in plasma cells). Patients often present with <b>CRAB</b>: hyperCalcemia, Renal failure, Anemia, Bone lesions.<br><br><b>High-yield recap:</b><br>- Bence Jones proteins = urine light chains<br>- Russell bodies = Ig inclusions in plasma cells<br>- CRAB = classic clinical features",3,,
Nutmeg liver' is most associated with which condition?,Left-sided heart failure,Right-sided heart failure,Portal hypertension,Cirrhosis,2,"<b>Nutmeg liver</b> is due to <b>chronic passive congestion</b> of the liver, classically from <b>right-sided heart failure</b>. Blood backs up into hepatic veins → centrilobular congestion and necrosis → speckled appearance. Long-term cases progress to <b>cardiac cirrhosis</b>.<br><br><b>High-yield recap:</b><br>- Etiology = right-sided CHF<br>- Congestion around central veins<br>- Severe → cardiac cirrhosis",3,,
“Owl’s eye” intranuclear inclusions in pneumocytes are characteristic of which virus?,Cytomegalovirus (CMV),Epstein-Barr virus (EBV),Herpes simplex virus (HSV),Varicella-zoster virus (VZV),1,"<b>Cytomegalovirus (CMV)</b> produces distinctive <b>'owl’s eye' intranuclear inclusions</b> in infected cells. CMV pneumonia is especially important in <b>immunocompromised patients</b> (HIV, transplant). Diagnosis can be made with biopsy or PCR.<br><br><b>High-yield recap:</b><br>- CMV = owl’s eye inclusions<br>- Pneumonia in immunocompromised<br>- Confirm by biopsy or PCR",3,,
Negri bodies are pathognomonic inclusions seen in which viral infection?,Rabies,Polio,Measles,Mumps,1,"<b>Negri bodies</b> are <b>cytoplasmic inclusions</b> found in neurons (Purkinje cells, hippocampus) of patients with <b>rabies</b>. Rabies presents with hydrophobia, encephalitis, and is almost uniformly fatal once symptomatic.<br><br><b>High-yield recap:</b><br>- Negri bodies = rabies<br>- Found in Purkinje & hippocampal neurons<br>- Symptomatic disease = almost always fatal",3,,
Elevated prostate-specific antigen (PSA) and acid phosphatase are markers for which malignancy?,Testicular cancer,Prostate cancer,Bladder cancer,Renal cell carcinoma,2,"<b>Prostate cancer</b> is monitored with <b>PSA</b>, though PSA can be elevated in BPH and prostatitis. <b>Prostatic acid phosphatase (PAP/PAcP)</b> historically indicated advanced disease, particularly with bone metastases. PSAP is still used in pathology immunostaining.<br><br><b>High-yield recap:</b><br>- PSA = screening/monitoring marker<br>- Acid phosphatase = advanced disease marker<br>- Metastasis commonly to bone",3,,
Which of the following best distinguishes a compound odontoma from a complex odontoma?,"Compound odontomas contain disorganized dental tissues without tooth-like structures, while complex odontomas contain multiple small tooth-like structures.","Compound odontomas contain multiple small tooth-like structures, while complex odontomas contain disorganized dental tissues without distinct tooth forms.","Compound odontomas arise in the posterior mandible, while complex odontomas arise in the anterior maxilla.","Compound odontomas are composed primarily of dentin, while complex odontomas are composed primarily of enamel.",2,"<b>Odontomas — Developmental Hamartomas</b><br><br>Odontomas are developmental anomalies (hamartomas) made of enamel, dentin, cementum, and pulp.<br><br><b>Compound odontomas</b> form multiple miniature tooth-like structures (denticles) with normal histologic arrangement and are usually found in the anterior maxilla.<br><br><b>Complex odontomas</b> form a disorganized calcified mass of dental tissues without structural resemblance to a tooth and usually occur in the posterior mandible.<br><br><b>High-Yield Summary:</b><br>- Compound → multiple tooth-like structures; anterior maxilla.<br>- Complex → disorganized mass; posterior mandible.<br>- Both benign; treated with simple excision.",3,,
Kaposi sarcoma is associated with which of the following viral infections?,Epstein–Barr virus,Cytomegalovirus,Human herpesvirus-8 (HHV-8),Human papillomavirus,3,"<b>Kaposi Sarcoma — Viral Etiology and Clinical Features</b><br><br>Kaposi sarcoma (KS) is a vascular neoplasm caused by infection with <b>HHV-8 (Human Herpesvirus-8)</b>. It is most common in immunocompromised patients, particularly those with AIDS.<br><br>Lesions appear as red-purple macules, plaques, or nodules that may affect skin, oral mucosa (especially the hard palate), or viscera.<br><br><b>Histology:</b> Spindle-shaped endothelial cells forming slit-like vascular channels with extravasated RBCs and hemosiderin.<br><br><b>High-Yield Summary:</b><br>- Etiology → HHV-8 infection.<br>- Common sites → palate, gingiva, skin, GI tract.<br>- Associated with HIV/AIDS, classic, and iatrogenic forms.<br>- Managed with HAART and local/systemic therapy.",3,,
"In pemphigus vulgaris, acantholysis occurs at which level of the oral epithelium?",Basal cell layer,Subepithelial connective tissue,Suprabasal layer,Spinous layer,3,"<b>Pemphigus Vulgaris — Autoimmune Intraepithelial Blistering Disorder</b><br><br>Pemphigus vulgaris (PV) is an autoimmune vesiculobullous disease characterized by IgG autoantibodies against <b>desmoglein-3</b>, a desmosomal cadherin responsible for epithelial cell adhesion.<br><br>Loss of cohesion (acantholysis) among keratinocytes leads to intraepithelial blistering at the <b>suprabasal level</b>, leaving basal cells attached to the basement membrane — the classic <b>“tombstone appearance.”</b><br><br><b>Clinical:</b> Fragile bullae rupture easily, leaving painful oral erosions (often first sign). Positive <b>Nikolsky sign</b> (epithelial sloughing with pressure).<br><br><b>High-Yield Summary:</b><br>- Target: Desmoglein-3 → desmosome loss.<br>- Level: Suprabasal cleft (intraepithelial).<br>- Histology: “Tombstone” basal cells.<br>- Clinical: Painful erosions, positive Nikolsky sign.<br>- Treatment: Corticosteroids and immunosuppressants.",3,,
